Section,Content
Special Clearance Requirements,"Temporary Import
Temporary import and exports for IMMEX is accepted for all modes.
Other types of temporary imports/exports (trade shows, conventions, exhibitions, repair/return, etc.) are accepted, depending on the commodity (see specific commodity listed on this page). Please allow extra time to clear Customs for these shipments as generally importers/exporters often are missing documents or require additional information to clear their shipments.
As for all entries, ensure the descriptions are very clear and, where applicable, serial numbers are listed on the invoices.
Goods imported/exported under a temporary customs clearance must export the country or territory in the time specified by the type of temporary clearance, which can be found on the MX Customs (SAT) website
Samples
Samples are items that by their quantity, weight, volume or other presentation conditions, indicate that without any doubt can only serve for the demonstration of goods or submit orders. Products, items or other goods, may be considered as samples if they fulfill the following criteria:
The unit value does not exceed one dollar.
That they are marked, torn, perforated or treated to be unsuitable for sale or any other use than sample. The marking shall consist on the use of paint or ink clearly visible, readable and permanent.
Not packaged for sale, except in the packaging material it is marked as sample.
Goods cannot be hard to identify, that by its presentation in the form of powder, liquids or pharmaceutical forms, such as: tablets, troches, pills, capsules, requiring physical/chemical analyzes to know its composition, nature, origin and other necessary measures to determine the tariff classification regardless of the quantity and value stated.
The samples must be unusable.
The samples cannot be commercialized or resold.
Commodities that cannot be made unusable, such as liquids, should be sent in minimum quantities without commercial labels, or with labels classifying the substance as a sample. A sample book is the collection of samples that for their quantity, weight, volume or other presentation conditions indicates without any doubt that can only serve as sample. In the case of samples or samples books of toys, the unit value of the toys may be up to $50.00 USD or their equivalent in local currency and may be imported up to two pieces of the same model.
Warranty Shipments
The shipper must indicate on the invoice that the shipment is a warranty repair or replacement. The consignee will be contacted regarding the Export Pedimento (Export Documents) and should be prepared to provide the necessary documentation.
Solid Wood Packing Material
New requirements have been implemented for both small package and WWEF shipments and are based on the International Standards for Phytosanitary Measures (ISPM) 15, which is entitled ""Guidelines for Regulating Wood Packaging Material in International Trade"". ISPM 15 was adopted internationally in 2002, and is gradually being introduced by countries or territories worldwide. Wood or wood products covered by ISPM 15 include items such as packing cases, boxes, crates, drums or similar packing, pallets, box pallets and other load boards, pallet collars and skids, but exclude such processed woods as orientated strand board, particle board, plywood or veneer, created using glue, heat and pressure or a combinations thereof, and, raw wood which is 6mm or less thick. It is recommended that if a question arises on this issue, please check with the authority that issues the Phytosanitary certificates in your country or territory.
Low Value Shipments
Shipments to Mexico valued at US$300.00 or less are cleared as informal in a consolidated entry. Goods that fall into this classification and in which the consignee requires a formal entry, require that the consignee notify UPS in Mexico of the shipment details such as tracking number, shipper, etc. at least one day prior to arrival or else it will be included in the informal consolidated entry.
Other Shipment Types
Amendment issued by the Indian Government with effect from 4th April 2020 prohibits diagnostic kits ITC HS Code 3822 for export from India."
Value Limits,"Import value limits to Mexico

Deminimis Value
Private Shipments

50.00 US Dollar (USD)
In most cases, when the value of the shipment is equal to or less than the Deminimis Value, the shipment may enter the country or territory duty and tax free.

Commercial Shipments

50.00 US Dollar (USD)
All non-document shipments may be assessed duty or tax or both regardless of the shipment value.

Export value limits to Mexico

High Value Shipments
Commercial Shipments

0.00 US Dollar (USD)
Formal Export Clearance Shipments:
Shipments valued at US$1,000.00 and above will need formal export clearance through Indian Customs. However, certain product types (for example, chemicals, pure jewelry, electronics) may also be subject to formal clearance. This formal clearance could take an additional day to process the shipment at origin
For pure jewelry item shipments, a value waiver is required if the value per piece exceeds US$500.00."
Weight and Size Limits,"Maximum weight:
70 kg (150 lbs.) per package
Maximum length:
274.00 cm (107.9 in.)  per package
Maximum dimensions:
419 cm (165 in. ) per package
Length and girth combined

Convert metric quantity for weight, length, and area."
