Section,Content
Commodity Specific Stipulations,"There are special stipulations on the following commodities when shipping to Mexico. If you plan to ship one of the commodities listed below, be sure to adhere to the following stipulations in order to avoid delays and holds at customs.
Medical Items
Mexican customs requires the consignee to obtain a permit from the Health Department (COFEPRIS) for all medicine or medical products regardless if they are from a company or from an individual for personal use.
In the case of medical items for personal use, an import permit must be processed with the Health Department (COFEPRIS); which will be granted for a single occasion if it meets all the requirements imposed. If this permit is not presented, customs will not clear the shipment.
These items are not authorized to be imported with the UPS Standard Service (Colombia & Tijuana) including toothpaste, dental floss, and any medical devices.
Electrical Items
Electrical products in Mexico are required to comply with the Quality Certification Standards (NOM's).
If the value of the shipment does not exceed 2,500 USD, the import can be carried out by simplified procedure, exempting compliance with the Quality Certification Standards (NOM's) (See numeral ""1. Simplified entry"" of the Commodity Specific Stipulation)
Toys
Toys can be imported according to their value (See the Commodity Specific Stipulation).
In the case of toys intended for children under 3 years of age, it is required to comply with a permit of the Health Department (COFEPRIS).
Chemicals
Chemical products require an attached technical letter and its corresponding HS Code. They are considered ""Difficult to identify goods"" and as such cannot be imported through a simplified procedure.
In addition, a tariff restriction may apply to the product depending on the HS Code.
Computers
Computers and Laptops can be imported no matter if they are used or new, but they need to comply with Quality Certification or Labeling Standards, aka NOM's, on shipments above 2,500 USD if applicable Link to SNICE
Printers, monitors, mouse, CPU, keyboard, memory units, readers and scanners are allowed in for repair.
In case your computer is transported with a lithium battery, please refer to Link to UPS Special Item Shipping Guide
Compact Discs
To import CDs, it is necessary to provide a document with a value equal to or greater than 1 USD.
Wood and Products made of Wood
All shipments containing solid wood require:
SEMARNAT permit: for Marketing Purposes or for Non-marketing Purposes
Confirmation of payment of SEMARNAT permit
Ocular inspection (RV) - link
Fumigation stamp on all the sides. This includes, pallets, crating and the goods being shipped
May require an international phytosanitary certificate before entering Mexico, depending on the characteristics of the product
Goods made of heat-treated or processed wood (plywood), require only the Ocular Inspection (RV) approval.
Drugs (also see Medicine)
Mexican customs requires the consignee to obtain a permit from the Health Department (COFEPRIS) for all medicine or medical products regardless if they are from a company or from an individual for personal use.
In the case of medicines for personal use, an import permit must be processed with the Health Department (COFEPRIS); which will be granted for a single occasion if it meets all the requirements imposed. If this permit is not presented, customs will not clear the shipment.
These items are not authorized to be imported with the UPS Standard Service (Colombia & Tijuana).
Animal Products
Cows, goats, sheep, and pigs are considered domesticated animals. All other animals are considered non-domesticated animals. Items or products made from non-domesticated animals are restricted in the UPS system and only allowed with a UPS ISC contract. CITES permit and additional restrictions may apply, please check with your local ISC Coordinator.
The importation into Mexico of products made with animals in danger of extinction is not allowed unless the recipient has a CITES permit and processes the import permit from the Secretariat of Natural Resources of Mexico (Semarnat).
Consumables
Articles sent to Mexico for human consumption (internal or external) require a pre-permit from the Health Ministry (Sanidad). Non-compliant shipments will be returned to origin as required by law.
Wheels
Customs allows imported wheels, however, the consignee must present to Customs a special certificate called ""NOM Certificate""; the Quality Certification Standards (aka NOM's) are mandatory for the importation and trade of tires, tubes or valves for motor vehicle wheels.
NOM-086/1-SCFI-2011 (tires)
NOM-086-SCFI-2010 (tires)
NOM-121-SCFI-2004 (inner tubes for tires)
NOM-134-SCFI-1999 (tire valves)
Animals and Animal Products
Articles sent to Mexico for animal consumption (internal or external) require a pre-arrival permit from the Ministry of Agriculture and Rural Development (SAGARPA). Non-compliant shipments will be returned to origin as required by the law.
Books
Most of the books are exempt from taxes by Mexican customs.
Fasteners
All fasteners, screws, nuts, washers, etc., must have the following elements listed on the invoice:
Specific name description
Specific dimensions
International identification code
Product weight in kilograms
If these elements are not specified, shipments will be held in customs.
Medicine (also see Drugs)
Mexican customs requires the consignee to obtain a permit from the Health Department (COFEPRIS) for all medicine or medical products regardless if they are from a company or from an individual for personal use.
In the case of medicine for personal use, an import permit must be processed with the Health Department (COFEPRIS); which will be granted for a single occasion if it meets all the requirements imposed. If this permit is not presented, customs will not clear the shipment.
These items are not authorized to be imported with the UPS Standard Service (Colombia & Tijuana).
Photographs
Photographs are exempt from taxes by Mexican customs.
Alcoholic Beverages and Wines
There are no gift exemptions for Mexico. All goods going into Mexico are subject to the normal duty and tax rates.
There are no gift exemptions for Mexico. All goods going into Mexico are subject to the normal duty and tax rates.
A Customs Broker must arrange clearance (either UPS broker or the importer's own broker). Alcoholic beverages are not a restricted commodity, but if the consignee cannot arrange clearance, then UPS will return any bottles that the contents are less than 24% of alcohol volume to the shipper. For bottles with more than 24% alcohol volume, UPS will abandon the shipment. These items are not authorized to be imported with the UPS Standard Service (Colombia & Tijuana).
For Formal Entry, Marbetes Tag for wine bottles is also required (Issued by a government agency in Mexico).
If the value of alcoholic beverages is less than 2500 USD, the importation may be carried out in a simplified procedure with prior authorization from the import customs office, paying the following fees:
Product / Fee
Beverages with alcoholic contenct and beer with an alcohol content of up to 14 degrees GL - 77% fee
Beverages with alcoholic contenct and beer with an alcohol content of up to 14 degrees GL and up to 20 degrees GL - 82% fee
Beverages with alcoholic contenct and beer with an alcohol content of more than 20 degrees GL - 114% fee
The above fees will have reductions if the products prove through documentation that they originate from a party country with which Mexico has entered into a Free Trade Agreement or Cooperation Agreement. Please consult the respective rate with the Brokerage or Compliance Team.
Vulnerable Products
UPS will not pay the duties and taxes arising from import and export entries (Pedimentos) of products considered as vulnerable for the Mexican authorities.
Duties and taxes will be paid through the PECA service (Centralized Customs Electronic Payment) according to the conditions and requirements established for this purpose.
Products considered as vulnerable:
Ground, air and sea vehicles; new and used
Gambling and lottery machines, new and used
Equipment and materials for the manufacture of payment cards
Jewelry, watches, gemstones and precious metals, with a value equal or greater than 485 times UMA´s (UMA=$96.22 MXP)
Art work, with a value equal or greater than 4815 times UMA´s (UMA=$96.22 MXP)
Ballistic resistant materials for service provision of vehicle shieling, regardless of the value of the goods
Semiconductor supports, smart cards, cards incorporating an electronic integrated circuit (smart cards)
Semiconductor supports, smart cards, cards incorporating an electronic integrated circuit (smart cards)
All the electronic cards to pay (debit cards, credit cards, gift certificates and others)
UPS cannot be the IOR on import of Vulnerable Products
PECE Centralized Customs Electronic PaymentIs the payment form for Vulnerable goods to prevent the Money Laundering, the importer need to update their RFC in SAT (Service Tax Administration)
Also is necessary to provide the following bank information, to pay the Pedimento Previously the importer need in their Bank Account register the patent Broker (Check where will be the Mexican Customs to clear to register the correct Broker License)
Branch where the account was open - Account number
Bank Name (only Banamex, Bancomer and HSBC)
Bank ID number (4 digits)
Personal Effects or Personal Goods
Personal effects or personal goods, items that are used for personal use such as clothing, footwear, toiletries, and beauty products (provided they are used for and during the trip taken), can be shipped and cleared through customs as personal effects / goods. These shipments, however, require a copy of the itinerary and passport showing the trip details (which Must be within 6 months of import), not for sale, and their CURP# (similar to a U.S. Social Security number) if a Mexican citizen.
Personal Effects / Goods must be clearly stated on the invoice and goods description.
If the shipment includes medicine, a copy of the prescription must be presented with the quantities and doses indicated.
Any items intended for any other use, such as wholesale or retail sales, business purposes, and/or for distribution are not considered personal effects and cannot be shipped on this basis.
Laptops can be considered as personal effects in Mexico, only if the goods are accompanied by the traveler at the time of arrival into Mexico.
Personal effects or Personal Goods:
Personal effects or Personal Goods:
Can only be shipped via UPS Express or UPS Expedited. Personal effects / goods that are shipped UPS Standard Service will result in the packages automatically returned to the Shipper.
Shipments sent via UPS Express or UPS Expedited service are accepted to most destinations and may be cleared by UPS or an alternate broker.
Due to Mexican customs restrictions, personal effects / goods will not be accepted to the greater Colombia and Tijuana areas. Shipments containing these commodities will be returned to shipper.
For shipments containing other commodities (e.g. not personal goods and/or effects), UPS must be the broker for U.S. to Mexico Standard service. Please refer to the link MX Port Contact List to verify which ports have restrictions regarding personal effects. These products may be subject to customs revision and may be held for an undefined period of time (see Immobilized shipments on see additional clearance information).
Tapes (Audio, Video, Magnetic)
An import license is required when the value of the shipment is equal to or greater than US$2500.
Prior to the shipment leaving the United States, the consignee must obtain the import license.
Traveler's Checks
Unused traveler's checks must have a signature in order to be shipped. If the value exceeds US$10,000 a declaration signed by the shipper and consignee must be presented to the Mexican government.
Declaration on bringing and taking money in cash and/or securities form (Spanish & English) may be found ""Secretaría de Hacienda y Crédito"" - Link
Food
For import to Mexico:
A permit is required to ship non-perishable foods to Mexico. Prior to shipping, the permit must be obtained by the consignee from the Department of Health in Mexico.
All the food supplements without Federal Commission for the Protection against Sanitary Risk permit (COFEPRIS) cannot be cleared for any Mexican Customs.
Sweets (Candy, Cookies, Chocolate, etc)
Food sold as sweets have additional taxes imposed by the government. To comply with classification, the invoice should list the percentage of sugar of the total product. For example, a candy bar may be 70% sugar by weight.
Candy cigarettes (chocolate, sugar, etc.) are prohibited to import into Mexico in all forms.
Please note This also applies for any gifts, personal or commercial.
For export from México to abroad:
For the export of food from Mexico to abroad, mainly to the USA, it is only allowed to be sent through air service, it is restricted through the standard service and will be returned to the sender.
It is important to mention that only the shipment of food through the air service is allowed in small amounts or for personal consumption, not for resale, for example: bread, tortillas, cheese, >i>mole (in powder and paste), typical sweets (like cocadas, turrones, palanquetas, etc.), pralines, marzipan, ate, wafers, sweet pumpkin and sweet potato, guava roll, ravioli and peanuts, chocolates, fruit preserves, preserves (beans, corn, hominy corn, chiles), dough for tamales (corn dried or ground or prepared dough), tamale leaves, dried chiles, sauces.
Textiles
New Clothing
When importing clothing with a declared value of US$2500 or greater, the consignee must have the following requirements in place to import textiles:
Padron de Importadores: Customer´s importer registration with the MX Customs Authority (SAT). This is completed through ""Secretaria de Hacienda y Crédito Público"" - link: SAT´s website.
Padron Sectorial: An additional certification on the importer´s registration allowing them to import textiles. This is completed through ""Secretaria de Hacienda y Crédito Público"" - link: SAT´s website.
Normas de Etiquetado: Labels/markings in the textiles comply with Mexican marking laws, or if goods are not for resale, a letter from the importer advising the goods will not be re-sold.
Certificado de Origen (Certificate of Origin) Optional. Required only when customer requests reduced duty through trade program (NAFTA, TPP, etc.)
Some ports in Mexico do not allow import of textiles via Small Package. Please refer to the Mexico's Contacts to assure accepted in the port for your customer.
Used Clothing
Used clothing can be imported only if the consignee left clothes behind in another country or territory while traveling, and the used clothing is for personal use. The consignee must present an airline ticket or passport to demonstrate that he or she has recently returned to Mexico from traveling abroad.
Other
Some products due to their presentation in the form of powders, liquids or pharmaceutical forms, such as pills, troches, tablets, granules, tablets, capsules and draggers, which require physical or chemical analysis, or both, to know their composition, nature, origin and other characteristics necessary to determine its tariff classification, regardless of the quantity and the consigned value. In this case, UPS will return these goods to their country of origin.
Within this classification customs authorities may consider some products like cosmetics (cream, make up, shampoo, etc.), as well as certain food, as products difficult to identify even if they have a commercial packing.
These products may be subject to customs revision and may be held for an undefined period of time (see Immobilized shipments on see additional clearance information).
Shoes
For small package shipments (only authorized ports of Entry) valued less then 2,500 USD there are not restrictions for import. For Small Package shipments greater then 2,500 USD or all SCS shipments, the consignee must have the following requirements:
Padron de Importadores: Customers importer registration with the MX Customs Authority (SAT). This is completed in SAT´s website and applies to all importers of any material.
Padron Sectorial: An additional certification on the importers registration allowing them to import textiles. This is completed in SAT´s website.
In order to avoid incorrect customs declarations at import, it is mandatory that the exporter provide all the detailed information about the shoes (what kind of leather, what material used for soles and uppers, if are sport shoes, sandals, boots and if are for children, women or men). Duties and taxes will be determined with this info. The only authorized ports to import shoes are:
Mexico City Airport
Ciudad Hidalgo Chiapas
Lazaro Cardenas Michoacan (ocean)
Manzanillo Colima (ocean)
Mexico City (known as Pantaco)
Guadalajara, Jalisco (only 10 pairs)
Nuevo Laredo, Tamaulipas
Progreso, Yucatan (Merida)
Tijuana, Baja California
Veracruz (ocean)
There are no restrictions for export shipments.
Checks (Non-negotiable checks)
Any person who enters or leaves the country with cash values (or through the UPS service), national or foreign checks, money order or any other document receivable, including a combination of them, with a value greater than $10,000 USD or the currency or equivalent currencies in question, they will be obliged to declare the amount before the customs authorities in the official forms approved by the National Customs Agency of Mexico (ANAM) or the SAT (Tax Administration Service), following the link you can download the approved form:
Download the form in (Declaration of income and withdrawal of cash and/or securities format (Spanish and English), here.
If the check is found by the authorities, it will be confiscated, and the consignee is subject to fines and penalties and can be subject to criminal prosecution.
Catalogs
Catalogs are exempt from taxes by Mexican customs.
Magazines
Magazines are exempt from taxes by Mexican customs.
But if it is part of a serialization (such as issues or editions) you must pay taxes.
Used clothes
Used clothing can be imported only if the consignee left clothes behind in another country or territory while traveling, and the used clothing is for personal use. The consignee must present an airline ticket or passport to demonstrate that he or she has recently returned to Mexico from traveling abroad.
In no other scheme/case is the importation of used clothing allowed.
Software
To import software is necessary to provide a document with the real value of the software."
Gift Exemptions,"Shipment value amount:
0.00 No Currency Specified 000
Shipment type:
no gift exemption
Exemption rule:
no gift exemption

There are no gift exemptions for this destination country or territory. All goods going into Mexico are subject to the normal duty and tax rates."
Invoice Requirements,"Invoice
Mexico is a paperless country, and it is required a copy of the commercial invoice (in English and/or Spanish).
Starting July 1, 2016, for commercial exports (goods which are being sold to another party), MX Customs requires electronic filing of the commercial invoice for all formal entries (pedimento A1). This is called CFDI (Comprobante Fiscal Digital Impreso). Additionally, starting January 1, 2017, numerous additional elements will be required to be transmitted.
Detailed information can be located here.
Important note: If there is any information that allows to identify the goods individually (serial numbers, parts, brand, model), these must be entered on the invoice. The point-of-sale value of the merchandise and the consignees tax identification number (RFC number) must be included. Visible corrections on invoices will not be accepted.
The consignees phone number is required on all documentation. Invoices on company letterhead or Online UPS invoices (Worldship) are preferred. All other types of invoices could cause shipments to be delayed in Customs.

A Validation of Information
The clearance information has been validated as current/correct as of November 2021. All consignees are required to be registered with the Mexican Tax Authority (SAT) to be able to import or export in Mexico. For Small Package moves, UPS will act as the importer of record up to US$1000 for businesses and US$5000 for individuals. This excludes goods which require special licensing or where Mexican law prevents UPS from acting as the importer/exporter.
For processes on how to register a business or an importer and for commodities which may require additional licensing, see overview here."
Items Classified as Documents,"The commodity information has been validated as current/correct as of September 2022. For Small Package moves, UPS will act as the importer of record up to US$2500. This excludes goods which require special licensing or where Mexican law prohibit UPS from acting as the importer/exporter, such as products of difficult identification in the presentation of liquids, powder or pills, for example certain food, cosmetics, medicines, dietary supplements, among others.
Documents
Documents shipped in letter envelopes, Paks, or boxes do not require an invoice for Customs. Mark an ""X"" in the Documents Only box on the waybill or Instruction Letter. There are no duties and taxes for documents only.
Airline Tickets
Airline tickets are considered documents as long as they have the name of the passenger and cannot be transferred.
Annual Reports
Bids
Bill of Lading
Passports
Passports for personal use only.
Seismic Data
Visa Applications
Greeting Cards, Invitations
Non-commercial use only.
Newsletters (Company)

UPS can recommend which forms you need based on a few simple criteria. Forms can be completed online or printed. See which forms you need."
Prohibited or Restricted Commodities,"In addition to the prohibited commodities listed here, it is prohibited to ship the following commodities to Mexico.
Negotiable Bonds, Drafts
Meat
Meat can only be imported/exported if the customer must have a Senasica permit, which is issued per shipment by the MX Government. More info can be found here.
Credit Cards
Credit cards, as they are merchandise marked as vulnerable products by the Mexican government, require for their import a formal entry with an IOR correctly registered in México other than UPS, payment of taxes directly from the IOR account ELECTRONIC PAYMENT FOREIGN TRADE (PECE) and several affidavits that identify the owner or ultimate beneficiary of these credit cards, since these can be used for the financing of crimes or management of resources of illicit origin.
Information on how to set up PECE payment can be found here.
For the previous reasons, the importation to Mexico of credit cards through small parcel with simple entry called T1 is restricted and all shipments will be returned to origin.
This restriction also applies to debit cards and all electronic payment cards.
Electronic Cigarette / Vaping Product
The importation of electronic cigarettes and vapers in all its forms is prohibited in Mexico.
Cigarettes/Tobacco
All products containing tobacco require a permit from COFEPRIS and payment of duties / taxes directly from the IOR account ""Centralized Customs Electronic Payment"" (PECE).
Link
In addition, cigarette importers require the Sectorial Import License (see section ""Registration in the specific sector of cigarettes""):
Link
Marijuana, including Marijuana intended for medical use
Marijuana is forbidden to import in Mexico in all forms. This includes seeds, tablets, ointment, herbs, dust, etc. even when intended for medical use.
Surgical Masks, Ventilators etc
S.No - ITC HS Codes - Description - Present Policy - Revised Policy
207 A - ex392690,ex621790,cx630790,ex901890,ex9020- Surgical Masks/ Disposable Masks (2/3 Ply Masks) - Free(As per Notification No. 48 dated 25.02.2020) - Prohibited.
207 B - ex9018 - All Ventilators - Free- Prohibited.
207 C -560311,560312,560313,560314,560391,560392,560393,560394 - Textile raw material for masks and coveralls - Free -Prohibited.
Military Equipment
The importation of weapons (and their parts such as telescopic sights or others), knives and explosives of any kind is regulated by the Mexican Army.
For knives, this rule applies specifically to knives that are for military use or as a weapon.
The army import permit (SEDENA) is required for each shipment.
If goods are denied access by the MX authorities, the goods will be seized by the government and not allowed to return to origin.
To know the requirements to get the permit please click here."
Saturday Delivery,"Saturday Delivery Available: Yes
Not available in all areas. Always check the international time in transit system for details of service availability within a country or territory.
Yes (Not available in all areas. Always check the international time in transit system for details of service availability within a country or territory) UPS offers Saturday delivery to selected postal codes in Mexico. The package must be shipped WW Express Saver and the shipper at the origin country or territory must place a ""Saturday Delivery"" sticker on the package. Always check the international time in transit system for details of service availability within a country or territory."
Service Options,"Always check Calculate Time and Cost for details of service availability and guarantee information within a country or territory. All Service Levels may not be available to or from every address within a country or territory.
India to Mexico
UPS Worldwide Expedited
UPS WorldWide Express Freight
WorldWide Express Freight Midday
UPS Worldwide Express
UPS Worldwide Express Saver"
