Section,Content
Import Documentation,"Paperless Invoice - Imports
UPS Paperless Invoice is accepted by Customs for small package imports into this country or territory.
Anti-Dumping
The Mexican government discourages dumping of goods into their market. In order to discourage dumping practices, they have established anti-dumping duties called ""Cuotas Compensatorias"".
Below is only a partial list of commodities subject to ""Cuotas Compensatorias"";
Commodity Percentage
Rate Cuota Compensatoria
Rate
Ceramic coatings for walls and floors
China From USD $2.90 to $12.42 /mt2, depending on the exporter
Ceramic tableware and loose parts of tableware
China Depending if the value is below USD $2.61 /kg
Stainless steel sinks
China USD $4.14 or $5.40 /kg, depending on the exporter
Aluminum pressure cookers
China 92.64%
Aluminum utensils for cooking
China USD $5.65 or $10.60 /kg, depending on the exporter
Bikes for children
China USD $13.12 /piece
Metallic plastic ballons
China USD $37.80 /kg
Pencils
China USD $0.0299 /piece
Plastic atomizers
China 86%
NAFTA Certificate of Origin
(Not applicable for U.S. to Puerto Rico or Puerto Rico to U.S.)
NAFTA (North American Free Trade Agreement) was established to allow preferential duty treatment for goods manufactured and shipped between the Customs territories of Canada, Mexico, and the United States (including Puerto Rico). The following information applies to commodities manufactured within the NAFTA region only.
For all commercial shipments over 1,000 USD, a completed NAFTA Certificate of Origin, supplied by the shipper, is required in order to qualify for a possible lower rate or elimination of duty.
In order for commercial shipments 1,000 USD or less to qualify for a possible lower rate or elimination of duty, the shipper must provide either:
A completed NAFTA Certificate of Origin, or
The NAFTA Statement on the commercial invoice.
The shipper also needs to print their name, title and date with a signature on the invoice.
Shipments importing to the U.S. for the sole purpose of personal use do not need the NAFTA Certificate of Origin or the NAFTA Statement ""I hereby certify that the goods covered by this shipment qualifies as an originating good for purposes of preferential tariff treatment under the NAFTA."" to qualify for NAFTA tariffs. If the goods are made in a NAFTA country or territory and the invoice states ""personal use"" the shipment will be processed under the NAFTA tariff codes. NAFTA does not exempt goods from Value Added Tax (in Mexico, IVA).
Certificates of Origin may be used for multiple importations of the same goods made in a period not exceeding one year from the issuance date of the Certificate. For more information, please see the following website:
http://www.sat.gob.mx/sitio_internet/aduana_mexico/importando_exportando/142_18126.html
Certificate of Origin
Certificates of origin are optional in most cases, but mandatory to obtain Preferential Tariff Treatment in accordance with the Treaties and Agreements to which Mexico is a party.
T-MEC certificate of origin link
MSDS-NON DG
Goods under IATA Special Provisions A67 require a MSDS (Material Safety Data Sheet).
It is not required for all, however shipments can be held by local authority in United Arab Emirates after screening due to lack of MSDS (Material Safety Data Sheet) or NON DG (Dangerous Goods) declaration letter from the shipper resulting to misconnections and impacting end-to-end service.
It would be advisable for all shipments originating, transiting and terminating for UAE to have MSDS or NON DG declaration from shipper enclosed in the shipment and copies to be uploaded in IDIS.
ADDITIONAL IMPORT DOCUMENTATION
On October 15, 2024, the Mexican Tax Administration System (SAT) has implemented modifications to the General Rules of Foreign Trade, which will impact air and ground transport operations with entry declaration T1.
 It will be mandatory to include:
 The full name, denomination or business name of the importer, recipient or consignee -must be included on each package.
TAX ID (Mexico’s RFC = Registro Federal de Contribuyentes), which is issued by Mexico Government.
Must include a detailed commercial description of the contents/merchandise contained in each package.
Commercial descriptions of the merchandise will be required to be detailed and specific. Generic descriptions such as “Courier and parcel items”, “Miscellaneous/various items”, “Gift”, “Present” or “Sample” will not be accepted. Any description that does not allow a clear identification of the merchandise will also not be allowed.
Examples of Unacceptable vs Acceptable Cargo Descriptions: U.S. Customs and Border Protection (cbp.gov)
The T1 is a customs-type procedure that allows courier shipments up to USD 2,500 to be cleared as express shipments. 

Packages that do not comply with the changes indicated above, will not be processed for import and will be automatically returned to origin.


Seismic Link - FAQ's New Rules in the Mexican Custom Regulation"
Clearance Information,"Customs Clearance Process
These adjustments apply only when ""UPS is not the customs broker"":
1) IMPORT OPERATION.
Step 1
UPS will deliver the shipment to the corresponding warehouse and collect the Proof of Delivery (POD).
Step 2
The customs broker assigned by the client, must request the shipment in the corresponding warehouse to perform the release process. Upon delivery to your customs broker, UPS is not responsible for delivery or additional costs incurred.
Step 3
The package is in the hands of your customs broker, so you can follow up directly with him.
1) EXPORT OPERATION.
Step 1
The customs broker assigned by you must go to the corresponding warehouse.
Step 2
Your customs broker must present these packages to the Mexican customs to carry out the customs clearance of exports.
Step 3
Upon completion of the customs clearance for export at the Mexican Customs, the customs broker needs to return the packages to the UPS warehouse. In order for UPS to receive the packages, they must be delivered with export entry.
For us it is very important to help our customers to establish effective import and export strategies, if you want UPS also has a customs clearance service, which gives you visibility from start to finish, if you need more information do not hesitate to contact your executive of account or to 01 800 PIDE UPS.
Post Office Boxes
UPS cannot deliver to a P.O. Box address. All packages require a consignee's contact name and complete street address including apartment, suite or unit number if applicable. The consignee's telephone number should be provided if known.
Limits on Imports by Individuals
Below are limits for goods allowed to be imported by individuals without permit or other government agency Mexico limits the quantity of the following commodities for import: 1. Clothes and accessories (including hats, socks and scarves: limit 10 pieces. 2. Computer equipment parts: limit 5 pieces of each type 3. Electric domestic items: limit 6 of each part 4. Fashion/custom jewelry: limit 20 pieces 5. Jewelry: limit 3 pieces 6. Motorcycle parts: limit 10 pieces 7. Records, cassettes or CD's: limit 20 pieces 8. Shoes: limit 10 pairs 9. Sporting goods: limit 1 piece
Door-to-Door Delivery
Customs may send a notice to the consignee for verification of shipment details if the shipment is dutiable and requires door-to-door delivery.
Missing Value
This indicates the consignee must provide either a Value Declaration form (sent to consignee with the Aviso) or a revised invoice for the package to clear Customs.
Package Delivery
RFI's for shipments to Mexico:
If ITT will not accept the Mexico postal code (when issuing a RFI only) use the following postal codes: 01000 or 15000. These postal codes can be used for imports and exports. Please reference the correct Mexico postal code in the remarks section of the RFI screen to get the postal code added to the system.
Payment by Credit Card
Credit card payments are accepted upon delivery for freight and import charges by this destination. Contact UPS or the UPS service partner in the destination country or territory to determine which credit cards are accepted.
Restrictions may apply for freight collect shipments from the origin country or territory. Contact UPS or the UPS service partner in the origin country or territory prior to shipping.
Warnings for Industrial Property for Trademarks
Mexican law dictates that any importing item which may be considered counterfeit trademark goods or pirated copyright goods, will be held by the Mexican competent authorities until the importer demonstrates the authenticity of such item.
Limits on Imports
f the value of the shipment is less than US$2500 UPS can be the IOR. If the value of the shipment is US$2500 or more, the consignee will automatically be considered a regular importer and will be required to have an Import License and complete the following forms in Spanish:  Carta de Traduccion (translation letter)  Carta de Encomienda (letter of authorization for UPS broker agent and depends of the Brokerage team in the Port of entry) If the consignee uses a UPS broker or any other Third Party Broker, all forms listed above are requested by customs. However, when using UPS Brokerage, the consignee does not pay higher fees due to transfer, handling, custody, transportation or warehouse. If a different broker is used, the forms must be completed and there will be higher broker fees. Goods that exceed US$2500 will be subject to tariff restrictions.
Gifts & Samples
GIFTS ONLY - With effect from 12 December 2019 all gift articles imported in India will attract duties and Taxes, The change is applicable with immediate effect for all such articles imported from any origin as gifts, irrespective of their declared value or utility to the receiver.
Clearance Comments
ANAM
On January 1, 2022, the National Customs Agency of Mexico (ANAM) came into operation as a decentralized administrative body of the Ministry of Finance and Public Credit (SHCP) replacing the General Customs Administration (AGA); which supposes a temporarily and indefinite transition period for their internal activities.
The National Customs Agency of Mexico will be endowed with technical, operational, administrative and management autonomy, it will have the character of a tax and Customs authority, in addition to having the power to issue resolutions within the scope of its competence. The creation of the Agency is given with the objective of continuing the strategy of the current administration in the fight against smuggling, the introduction of drugs and corruption.
Carta Porte
The CFDI with Carta Porte Complement is a digital, fiscal document that is a new obligation of transport companies in Mexico since January 1, 2022, to issue that contains detailed information on the merchandise. The Mexican government will use this to verify the operations carried out by the participants in the transfer of merchandise. It´s the full obligation of the Carrier company to generate it properly.
In order to generate this document automatically, UPS will rely on technological tools that allow us to extract information directly from air waybills generated by customers; therefore, as of January 1, 2022, UPS Manual Waybills will no longer be available.
Given this change, in order to make shipments in the shortest possible time and without errors, customers must be kept informed, analyze their shipping history, upload documentation, etc. Our strategy is focused on helping your company to go digital through the use of tools such as Worldship or CampuShip. We recommend you take your precautions to avoid setbacks.
Immobilized Shipments
According to Customs Legislation, Customs authorities and Other Government Agencies (OGA) have the power to held shipments to review if they are in compliance with Mexican Legislation and to avoid illegal practices, such as drugs, piracy, undervaluation, etc. The shipments may remain at hold for an undefined period that can take up to six weeks depending on the authorities analysis, without the control of UPS.
Any product could be subject to inspection, the main affected items are: personal effects, products of difficult identification (such as liquids, powder, etc), food, clothing, among others.
NEW HTS CODES FOR MEXICO EFFECTIVE ON DECEMBER 28, 2020
These changes are the result of the implementation in Mexico of the sixth amendment to the Harmonized System, in accordance with the recommendations of the World Customs Organization (WCO)
The core change is the increase from 8 to 10 digits in the HTS codes for Mexico, which implies a reordering in all the HTS codes, grouping some HTS codes, deleting and creating others for the establishment of a more compact and functional Tariff (HTS), for which it is important to take into account the correlation tables for the current and new HTS codes available in this link, section ""Base Unica RRNAs""
Regarding this change, it is important to note that the HTS code that is currently declared and must be declared as of December 28 in permits or regulations is in 8 digits, which for Mexico is known as ""Fraccion Arancelaria"", since the 10 digits that will be implemented from the date indicated is for statistical and tax purposes, not for regulations or permits."
Areas Served,"Service is provided to and from certain cities.
Intra-Mexico UPS Services
Domestic Express Saver Service is offered all over the country or territory
Domestic Express Plus 8:30 a.m. and Domestic Express 10:30 a.m. are available only to and from specific zip codes within main cities in Mexico
Shippers within Mexico may call the UPS toll free customer service line at 01-800-90-292-00 for more information regarding the Domestic Express Services.
There is a Mexican imposed tariff (known as I.V.A.) for Mexico Domestic rates.
Note: See details in the Mexico web page rate chart.
UPS cannot deliver to a P.O. Box address. All packages require a consignee's contact name and complete street address including apartment, suite or unit number if applicable. The consignee's telephone number should be provided if known.
Rest Days:
Sunday, Saturday, and official holidays.
GMT:
Spring -0600/ Fall -0600
Language:
Spanish
Currency:
Mexican Nuevo Peso(MXN)
For rate inquiry use (MEP)"
Billing Options,"Payment Methods
When paying by credit card, check, or cash, only the shipper can be billed the shipping charges
Third-Party Billing
Please note the following third party billing exceptions:
Shipments to and from the same country or territory (domestic shipments) cannot be billed to third party payors in other countries or territories. For example, shipments from Mexico to Mexico or Canada to Canada cannot be billed to a third party payor in the U.S. This rule does not apply to UPS domestic services in European Union countries or territories. For example, shipments from Germany to Germany can be billed to a third party payor in the U.S. (as long as the payor is a business and has a VAT or Tax/EIN ID on file with UPS).
Duties and Taxes
Duties and taxes can be billed to the shipper, receiver or a third party.
When billing a third party, the third party's name, country or territory and account number are required.
If the duties and taxes are billed to an account outside of the destination country or territory, a ""Duty and Tax Forwarding"" surcharge will be applied.
Shipping Charges
Shipping charges can be billed to the shipper, receiver or a third party.
When billing the receiver, either the shipper or receiver's account number is required.
When billing to a third party, the third party's name, country or territory and account number are required."
